{
  "slug": "precio-de-los-cinco",
  "titulo": "El precio de los Cinco",
  "subtitulo": "Cuánto costó, a cada gobierno, detener, juzgar y encarcelar a cinco agentes de la Red Avispa, y cuánto gastó La Habana en la campaña para traerlos de vuelta. Un modelo con dos libros de cuentas, cada partida con su fuente y su grado de confianza.",
  "version_datos": "2026-10-19",
  "expediente": {
    "caso": "98-00721-CR-JAL",
    "tribunal": "Distrito Sur de Florida",
    "hitos": [
      {
        "fecha": "1998-09-12",
        "evento": "Detención",
        "confianza": "confirmado"
      },
      {
        "fecha": "2001-06-08",
        "evento": "Veredicto",
        "confianza": "confirmado"
      },
      {
        "fecha": "2014-12-17",
        "evento": "Canje",
        "confianza": "confirmado"
      }
    ]
  },
  "totales": {
    "eeuu": {
      "p5": 26319519,
      "p50": 32110550,
      "p95": 39642064,
      "confianza": "estimado"
    },
    "cuba": {
      "p5": 34099117,
      "p50": 55118563,
      "p95": 87139772,
      "confianza": "estimado"
    },
    "total": {
      "p5": 65418465,
      "p50": 87678410,
      "p95": 120189551,
      "confianza": "estimado"
    },
    "total_nominal": {
      "p5": 38329071,
      "p50": 52206343,
      "p95": 72875204,
      "confianza": "estimado"
    }
  },
  "partidas": [
    {
      "id": "us_fbi",
      "libro": "eeuu",
      "nombre": "Investigación del FBI (vigilancia FISA, descifrado, detenciones)",
      "confianza": "estimado",
      "periodo": [
        1995,
        1999
      ],
      "en_total": true,
      "usd2025": {
        "p5": 10187853,
        "p50": 15611056,
        "p95": 22977817
      },
      "nominal": {
        "p5": 5054600,
        "p50": 7745268,
        "p95": 11400211
      },
      "factor_2025": 2.016,
      "nota": "4 años de 8 a 25 equivalentes a tiempo completo con coste cargado de 100-155 mil USD/año. Sin cifra oficial; el FBI obtuvo autorización FISA en 1995.",
      "fuentes": [
        "havanatimes_habeas",
        "washtimes_2001"
      ]
    },
    {
      "id": "us_fiscalia",
      "libro": "eeuu",
      "nombre": "Fiscalía federal (SDFL): instrucción, juicio, apelaciones y hábeas",
      "confianza": "estimado",
      "periodo": [
        1998,
        2014
      ],
      "en_total": true,
      "usd2025": {
        "p5": 5015282,
        "p50": 6271526,
        "p95": 7884128
      },
      "nominal": {
        "p5": 3079704,
        "p50": 3851119,
        "p95": 4841360
      },
      "factor_2025": 1.628,
      "nota": "Equipo de 3-5 fiscales y apoyo hasta la sentencia (2,75 años) y 0,5-1,5 a tiempo completo durante 13 años de apelaciones, resentencias y hábeas.",
      "fuentes": [
        "campa_2008",
        "jurist_2009"
      ]
    },
    {
      "id": "us_defensa_juicio",
      "libro": "eeuu",
      "nombre": "Defensa de oficio en primera instancia (CJA + defensor público)",
      "confianza": "estimado",
      "periodo": [
        1998,
        2001
      ],
      "en_total": true,
      "usd2025": {
        "p5": 2811213,
        "p50": 3411219,
        "p95": 4078548
      },
      "nominal": {
        "p5": 1480562,
        "p50": 1796563,
        "p95": 2148020
      },
      "factor_2025": 1.899,
      "nota": "Cuatro abogados del panel CJA (tarifa 50-75 USD/h en 2000-2001) más un defensor público, peritos, investigadores y declaraciones tomadas en Cuba.",
      "fuentes": [
        "herald_2001",
        "cja_txs"
      ]
    },
    {
      "id": "us_defensa_apel",
      "libro": "eeuu",
      "nombre": "Defensa en apelaciones y hábeas (2002-2014)",
      "confianza": "estimado",
      "periodo": [
        2002,
        2014
      ],
      "en_total": true,
      "usd2025": {
        "p5": 556057,
        "p50": 1137573,
        "p95": 1945165
      },
      "nominal": {
        "p5": 359828,
        "p50": 736131,
        "p95": 1258730
      },
      "factor_2025": 1.545,
      "nota": "Fuente de financiación no confirmada: parte fue trabajo pro bono o privado (Weinglass, Akin Gump). Rango amplio por esa razón.",
      "fuentes": [
        "scotus_appendix",
        "weinglass"
      ]
    },
    {
      "id": "us_tribunal",
      "libro": "eeuu",
      "nombre": "Tribunal: siete meses de juicio, jurado, alguaciles y seguridad",
      "confianza": "estimado",
      "periodo": [
        2000,
        2001
      ],
      "en_total": true,
      "usd2025": {
        "p5": 1025632,
        "p50": 1673656,
        "p95": 2546191
      },
      "nominal": {
        "p5": 556283,
        "p50": 907759,
        "p95": 1381004
      },
      "factor_2025": 1.844,
      "nota": "Juicio de unos siete meses, el más largo del país en su momento según varias fuentes; más de 20.000 páginas de pruebas.",
      "fuentes": [
        "kimber_trial",
        "wiki_cuban5"
      ]
    },
    {
      "id": "us_carcel",
      "libro": "eeuu",
      "nombre": "Custodia y prisión (77,3 años-persona)",
      "confianza": "calculado",
      "periodo": [
        1998,
        2014
      ],
      "en_total": true,
      "usd2025": {
        "p5": 3361065,
        "p50": 3747417,
        "p95": 4233587
      },
      "nominal": {
        "p5": 2063910,
        "p50": 2301154,
        "p95": 2599694
      },
      "factor_2025": 1.628,
      "nota": "Días de custodia de cada uno multiplicados por la tarifa media anual de la Oficina de Prisiones (COIF), interpolada entre los años publicados. El multiplicador 1,0-1,4 cubre el sobrecoste de las prisiones de alta seguridad.",
      "fuentes": [
        "bop_2003",
        "bop_2008",
        "uscourts_2010",
        "bop_2015"
      ]
    },
    {
      "id": "us_libertad_sup",
      "libro": "eeuu",
      "nombre": "Libertad supervisada de René González (2011-2013)",
      "confianza": "calculado",
      "periodo": [
        2011,
        2013
      ],
      "en_total": true,
      "usd2025": {
        "p5": 8854,
        "p50": 8854,
        "p95": 8854
      },
      "nominal": {
        "p5": 6301,
        "p50": 6301,
        "p95": 6301
      },
      "factor_2025": 1.405,
      "nota": "Unos 1,6 años a 10,79 USD/día (coste de supervisión federal en 2010).",
      "fuentes": [
        "uscourts_2010",
        "ips_rene"
      ]
    },
    {
      "id": "cu_red",
      "libro": "cuba",
      "nombre": "Operación de la Red Avispa (14 miembros, ~1992-1998)",
      "confianza": "estimado",
      "periodo": [
        1992,
        1998
      ],
      "en_total": true,
      "usd2025": {
        "p5": 3598062,
        "p50": 5329763,
        "p95": 7425981
      },
      "nominal": {
        "p5": 1697155,
        "p50": 2513974,
        "p95": 3502731
      },
      "factor_2025": 2.12,
      "nota": "Anclaje: un agente vivía con un presupuesto de 30.935 USD asignado por La Habana en 1996. Varios agentes tenían dos empleos para pagar el alquiler. Se suma el apoyo desde La Habana (control, radio, formación).",
      "fuentes": [
        "ap_2000_budget",
        "guardian_lowbudget",
        "cubanet_14"
      ]
    },
    {
      "id": "cu_visitas",
      "libro": "cuba",
      "nombre": "Viajes de familiares a las prisiones",
      "confianza": "estimado",
      "periodo": [
        2001,
        2014
      ],
      "en_total": true,
      "usd2025": {
        "p5": 529466,
        "p50": 814275,
        "p95": 1211982
      },
      "nominal": {
        "p5": 338359,
        "p50": 520368,
        "p95": 774526
      },
      "factor_2025": 1.565,
      "nota": "Menos de una visita al año por preso de media, según grupos de apoyo; a Olga Salanueva y Adriana Pérez se les negó el visado repetidamente. Se asume que el Estado cubano pagó los viajes.",
      "fuentes": [
        "amnesty_2009",
        "bulatlat"
      ]
    },
    {
      "id": "cu_legal",
      "libro": "cuba",
      "nombre": "Apoyo legal pagado por Cuba",
      "confianza": "no_cuantificado",
      "periodo": [
        2001,
        2014
      ],
      "en_total": false,
      "usd2025": {
        "p5": 234103,
        "p50": 861878,
        "p95": 1875698
      },
      "nominal": {
        "p5": 149605,
        "p50": 550789,
        "p95": 1198678
      },
      "factor_2025": 1.565,
      "nota": "No hay prueba de que Cuba pagara la defensa del juicio, que fue de oficio. Este rango cubre posibles pagos en apelaciones y no debe leerse como cifra.",
      "fuentes": [
        "herald_2001"
      ]
    },
    {
      "id": "cu_coloquios",
      "libro": "cuba",
      "nombre": "Coloquios internacionales de Holguín (9 ediciones)",
      "confianza": "estimado",
      "periodo": [
        2005,
        2013
      ],
      "en_total": true,
      "usd2025": {
        "p5": 1868271,
        "p50": 3060275,
        "p95": 4660857
      },
      "nominal": {
        "p5": 1246813,
        "p50": 2042311,
        "p95": 3110479
      },
      "factor_2025": 1.498,
      "nota": "300-413 delegados de unos 50 países por edición, más marchas y actos locales. Los delegados pagaban en general su propio vuelo; Cuba cubría la logística en la isla.",
      "fuentes": [
        "rebelion_vi",
        "rebelion_vii",
        "vermelho_viii",
        "counterpunch_ix"
      ]
    },
    {
      "id": "cu_embajadas",
      "libro": "cuba",
      "nombre": "Red exterior: embajadas, ICAP y apoyo a comités",
      "confianza": "estimado",
      "periodo": [
        2001,
        2014
      ],
      "en_total": true,
      "usd2025": {
        "p5": 12433250,
        "p50": 31885039,
        "p95": 63556457
      },
      "nominal": {
        "p5": 7945556,
        "p50": 20376360,
        "p95": 40616203
      },
      "factor_2025": 1.565,
      "nota": "833 países-año con actividad documentada (comités en 27 países en 2006 y en unos 110 en 2011-2012), por un gasto marginal de 4.000-60.000 USD por país y año. No existe desglose por embajada.",
      "fuentes": [
        "wiki2006",
        "rebelion_346",